PowerShell 7.2.6
Copyright (c) Microsoft Corporation.

https://aka.ms/powershell
Type 'help' to get help.

Loading personal and system profiles took 2375ms.
  ~  master  ≢  ?54    xampp
xampp: The term 'xampp' is not recognized as a name of a cmdlet, function, script file, or executable program.
Check the spelling of the name, or if a path was included, verify that the path is correct and try again.
  ~  master  ≢  ?54    cd :
Set-Location: Cannot find path 'C:\Users\ASUS\:' because it does not exist.
  ~  master  ≢  ?54    cd d:
  D:\    cd e:
  E:\    ls

        Directory: E:\


Mode                LastWriteTime         Length Name
----                -------------         ------ ----
d----        17-08-2022  09:39 PM                  Anaconda
d----        16-08-2022  04:07 PM                  Anydesk
d----        27-04-2022  07:23 PM                  ASUS
d----        28-06-2022  08:07 PM                  DaVinci Resolve
d----        02-06-2022  06:32 PM                  DeliveryOptimization
d----        12-07-2022  09:23 PM                  GIMP 2
d----        02-06-2022  06:41 PM                  Git
d----        10-06-2022  10:07 PM                  IntelliJ IDEA Community Edition 2022.1.2
d----        24-08-2022  05:26 PM                  Kali Linux
d----        21-09-2022  05:53 PM                  Microsoft VS Code
d----        03-06-2022  04:17 PM                  MinGW
d----        18-08-2022  06:17 PM                  New folder
d----        16-06-2022  03:19 PM                  Node
d----        04-06-2022  07:41 PM                  obs
d----        27-04-2022  07:23 PM                  Program Files
d----        04-09-2022  05:37 PM                  Python 3.10
d----        07-08-2022  08:02 AM                  Riot Games
d----        24-08-2022  06:02 PM                  SEED Labs
d----        24-08-2022  06:02 PM                  Seed Labs I2
d----        02-06-2022  06:54 PM                  vim
d----        14-08-2022  11:21 AM                  Virtual Box
d----        26-09-2021  11:34 AM                  Windows
d----        03-06-2022  09:24 PM                  Windows 10 Virtual Machine
d----        02-06-2022  06:32 PM                  WindowsApps
d----        25-08-2022  11:08 AM                  wondershare
d----        13-09-2022  02:57 PM                  xampp

  E:\    cd .\xampp\
  xampp    ls

        Directory: E:\xampp


Mode                LastWriteTime         Length Name
----                -------------         ------ ----
d----        13-09-2022  02:50 PM                  anonymous
d----        13-09-2022  02:50 PM                  apache
d----        13-09-2022  02:57 PM                  cgi-bin
d----        13-09-2022  02:50 PM                  contrib
d----        13-09-2022  02:57 PM                  FileZillaFTP
d----        13-09-2022  02:50 PM                  htdocs
d----        13-09-2022  02:50 PM                  img
d----        13-09-2022  02:57 PM                  install
d----        13-09-2022  02:50 PM                  licenses
d----        13-09-2022  02:50 PM                  locale
d----        13-09-2022  02:50 PM                  mailoutput
d----        13-09-2022  02:50 PM                  mailtodisk
d----        13-09-2022  02:57 PM                  MercuryMail
d----        13-09-2022  02:50 PM                  mysql
d----        13-09-2022  02:52 PM                  perl
d----        13-09-2022  02:57 PM                  php
d----        13-09-2022  03:22 PM                  phpMyAdmin
d----        13-09-2022  02:57 PM                  sendmail
d----        13-09-2022  02:50 PM                  src
d----        23-09-2022  09:28 AM                  tmp
d----        13-09-2022  02:51 PM                  tomcat
d----        13-09-2022  02:57 PM                  webalizer
d----        13-09-2022  02:50 PM                  webdav
-a---        07-06-2013  04:45 PM            436   apache_start.bat
-a---        13-09-2022  02:57 PM            176   apache_stop.bat
-a---        05-04-2021  09:46 PM          10324   catalina_service.bat
-a---        05-04-2021  09:47 PM           3766   catalina_start.bat
-a---        05-04-2021  09:47 PM           3529   catalina_stop.bat
-a---        13-09-2022  02:50 PM           2731   ctlscript.bat
-a---        30-03-2013  05:59 PM             78   filezilla_setup.bat
-a---        07-06-2013  04:45 PM            150   filezilla_start.bat
-a---        07-06-2013  04:45 PM            149   filezilla_stop.bat
-a---        27-08-2019  07:31 PM            299   killprocess.bat
-a---        07-06-2013  04:45 PM            136   mercury_start.bat
-a---        07-06-2013  04:45 PM             60   mercury_stop.bat
-a---        03-06-2019  05:09 PM            471   mysql_start.bat
-a---        13-09-2022  02:57 PM            256   mysql_stop.bat
-a---        13-03-2017  04:34 PM            824   passwords.txt
-a---        13-09-2022  02:57 PM            791   properties.ini
-a---        16-05-2022  04:29 PM           7496   readme_de.txt
-a---        16-05-2022  04:29 PM           7366   readme_en.txt
-a---        30-03-2013  05:59 PM          60928 ﬓ  service.exe
-a---        30-03-2013  05:59 PM           1255   setup_xampp.bat
-a---        29-11-2020  07:08 PM           1671   test_php.bat
-a---        13-09-2022  02:57 PM         259169   uninstall.dat
-a---        13-09-2022  02:57 PM       12524302 ﬓ  uninstall.exe
-a---        13-09-2022  02:50 PM           1084   xampp_shell.bat
-a---        30-03-2013  05:59 PM         118784 ﬓ  xampp_start.exe
-a---        30-03-2013  05:59 PM         118784 ﬓ  xampp_stop.exe
-a---        06-04-2021  05:08 PM        3368448 ﬓ  xampp-control.exe
-a---        13-09-2022  02:57 PM            178   xampp-control.ini

  xampp    cd .\mysql\
  mysql    ls

        Directory: E:\xampp\mysql


Mode                LastWriteTime         Length Name
----                -------------         ------ ----
d----        13-09-2022  02:50 PM                  backup
d----        13-09-2022  02:57 PM                  bin
d----        23-09-2022  09:28 AM                  data
d----        13-09-2022  02:50 PM                  scripts
d----        13-09-2022  02:50 PM                  share
-a---        11-02-2022  01:12 AM          17987   COPYING
-a---        11-02-2022  01:12 AM           2093   CREDITS
-a---        30-03-2013  05:59 PM            848   mysql_installservice.bat
-a---        30-03-2013  05:59 PM            395   mysql_uninstallservice.bat
-a---        11-02-2022  01:12 AM           2874   README.md
-a---        03-06-2019  05:09 PM           1095   resetroot.bat
-a---        11-02-2022  01:12 AM          86263   THIRDPARTY

  mysql    cd .\bin\
  bin    mysql -u root -p
mysql: The term 'mysql' is not recognized as a name of a cmdlet, function, script file, or executable program.
Check the spelling of the name, or if a path was included, verify that the path is correct and try again.

Suggestion [3,General]: The command mysql was not found, but does exist in the current location. PowerShell does not load commands from the current location by default. If you trust this command, instead type: ".\mysql". See "get-help about_Command_Precedence" for more details.
  bin    ls

        Directory: E:\xampp\mysql\bin


Mode                LastWriteTime         Length Name
----                -------------         ------ ----
-a---        02-12-2020  11:00 AM          12240   api-ms-win-core-console-l1-1-0.dll
-a---        02-12-2020  11:00 AM          12256   api-ms-win-core-console-l1-2-0.dll
-a---        02-12-2020  11:00 AM          11736   api-ms-win-core-datetime-l1-1-0.dll
-a---        02-12-2020  11:00 AM          11728   api-ms-win-core-debug-l1-1-0.dll
-a---        02-12-2020  11:00 AM          11728   api-ms-win-core-errorhandling-l1-1-0.dll
-a---        02-12-2020  11:00 AM          15328   api-ms-win-core-file-l1-1-0.dll
-a---        02-12-2020  11:00 AM          11728   api-ms-win-core-file-l1-2-0.dll
-a---        02-12-2020  11:00 AM          11744   api-ms-win-core-file-l2-1-0.dll
-a---        02-12-2020  11:00 AM          11736   api-ms-win-core-handle-l1-1-0.dll
-a---        02-12-2020  11:00 AM          12256   api-ms-win-core-heap-l1-1-0.dll
-a---        02-12-2020  11:00 AM          11728   api-ms-win-core-interlocked-l1-1-0.dll
-a---        02-12-2020  11:00 AM          12752   api-ms-win-core-libraryloader-l1-1-0.dll
-a---        02-12-2020  11:00 AM          14800   api-ms-win-core-localization-l1-2-0.dll
-a---        02-12-2020  11:00 AM          12240   api-ms-win-core-memory-l1-1-0.dll
-a---        02-12-2020  11:00 AM          11728   api-ms-win-core-namedpipe-l1-1-0.dll
-a---        02-12-2020  11:00 AM          12752   api-ms-win-core-processenvironment-l1-1-0.dll
-a---        02-12-2020  11:00 AM          14288   api-ms-win-core-processthreads-l1-1-0.dll
-a---        02-12-2020  11:00 AM          12240   api-ms-win-core-processthreads-l1-1-1.dll
-a---        02-12-2020  11:00 AM          11728   api-ms-win-core-profile-l1-1-0.dll
-a---        02-12-2020  11:00 AM          12240   api-ms-win-core-rtlsupport-l1-1-0.dll
-a---        02-12-2020  11:00 AM          11728   api-ms-win-core-string-l1-1-0.dll
-a---        02-12-2020  11:00 AM          13776   api-ms-win-core-synch-l1-1-0.dll
-a---        02-12-2020  11:00 AM          12240   api-ms-win-core-synch-l1-2-0.dll
-a---        02-12-2020  11:00 AM          12768   api-ms-win-core-sysinfo-l1-1-0.dll
-a---        02-12-2020  11:00 AM          12240   api-ms-win-core-timezone-l1-1-0.dll
-a---        02-12-2020  11:00 AM          11728   api-ms-win-core-util-l1-1-0.dll
-a---        02-12-2020  11:00 AM          12752   api-ms-win-crt-conio-l1-1-0.dll
-a---        02-12-2020  11:01 AM          15824   api-ms-win-crt-convert-l1-1-0.dll
-a---        02-12-2020  11:00 AM          12240   api-ms-win-crt-environment-l1-1-0.dll
-a---        02-12-2020  11:01 AM          13776   api-ms-win-crt-filesystem-l1-1-0.dll
-a---        02-12-2020  11:00 AM          12752   api-ms-win-crt-heap-l1-1-0.dll
-a---        02-12-2020  11:00 AM          12240   api-ms-win-crt-locale-l1-1-0.dll
-a---        02-12-2020  11:00 AM          20944   api-ms-win-crt-math-l1-1-0.dll
-a---        02-12-2020  11:00 AM          19920   api-ms-win-crt-multibyte-l1-1-0.dll
-a---        02-12-2020  11:00 AM          64464   api-ms-win-crt-private-l1-1-0.dll
-a---        02-12-2020  11:00 AM          12752   api-ms-win-crt-process-l1-1-0.dll
-a---        02-12-2020  11:00 AM          16336   api-ms-win-crt-runtime-l1-1-0.dll
-a---        02-12-2020  11:00 AM          17872   api-ms-win-crt-stdio-l1-1-0.dll
-a---        02-12-2020  11:00 AM          18384   api-ms-win-crt-string-l1-1-0.dll
-a---        02-12-2020  11:00 AM          14288   api-ms-win-crt-time-l1-1-0.dll
-a---        02-12-2020  11:00 AM          12240   api-ms-win-crt-utility-l1-1-0.dll
-a---        11-02-2022  02:23 AM        4372656 ﬓ  aria_chk.exe
-a---        11-02-2022  02:23 AM        3950256 ﬓ  aria_dump_log.exe
-a---        11-02-2022  02:23 AM        4186800 ﬓ  aria_ftdump.exe
-a---        11-02-2022  02:23 AM        4228784 ﬓ  aria_pack.exe
-a---        11-02-2022  02:23 AM        4352176 ﬓ  aria_read_log.exe
-a---        11-02-2022  02:22 AM        3497648 ﬓ  innochecksum.exe
-a---        11-02-2022  02:23 AM         312496   libmariadb.dll
-a---        11-02-2022  02:22 AM       15558832 ﬓ  mariabackup.exe
-a---        11-02-2022  02:22 AM        3431600 ﬓ  mbstream.exe
-a---        11-02-2022  02:22 AM        3421872 ﬓ  my_print_defaults.exe
-a---        13-09-2022  02:57 PM           5776   my.ini
-a---        11-02-2022  02:23 AM        3608752 ﬓ  myisam_ftdump.exe
-a---        11-02-2022  02:23 AM        3743408 ﬓ  myisamchk.exe
-a---        11-02-2022  02:23 AM        3624624 ﬓ  myisamlog.exe
-a---        11-02-2022  02:23 AM        3644080 ﬓ  myisampack.exe
-a---        11-02-2022  02:08 AM          25746   myrocks_hotbackup
-a---        11-02-2022  02:08 AM           8878   mysql_config.pl
-a---        11-02-2022  02:08 AM           4384   mysql_convert_table_format.pl
-a---        11-02-2022  02:23 AM        4949680 ﬓ  mysql_install_db.exe
-a---        11-02-2022  02:23 AM        3339440 ﬓ  mysql_ldb.exe
-a---        11-02-2022  02:22 AM        3416752 ﬓ  mysql_plugin.exe
-a---        11-02-2022  02:23 AM        3429552 ﬓ  mysql_tzinfo_to_sql.exe
-a---        11-02-2022  02:23 AM        3410096 ﬓ  mysql_upgrade_service.exe
-a---        11-02-2022  02:23 AM        2656944 ﬓ  mysql_upgrade_wizard.exe
-a---        11-02-2022  02:22 AM        3524272 ﬓ  mysql_upgrade.exe
-a---        11-02-2022  02:22 AM        3790000 ﬓ  mysql.exe
-a---        11-02-2022  02:22 AM        3695792 ﬓ  mysqladmin.exe
-a---        11-02-2022  02:22 AM        3827376 ﬓ  mysqlbinlog.exe
-a---        11-02-2022  02:22 AM        3705520 ﬓ  mysqlcheck.exe
-a---        11-02-2022  02:08 AM          28628   mysqld_multi.pl
-a---        11-02-2022  02:23 AM       16487088 ﬓ  mysqld.exe
-a---        11-02-2022  02:22 AM        3779760 ﬓ  mysqldump.exe
-a---        11-02-2022  02:08 AM           8478   mysqldumpslow.pl
-a---        11-02-2022  02:08 AM          36124   mysqlhotcopy.pl
-a---        11-02-2022  02:22 AM        3678896 ﬓ  mysqlimport.exe
-a---        11-02-2022  02:22 AM        3677872 ﬓ  mysqlshow.exe
-a---        11-02-2022  02:22 AM        3695280 ﬓ  mysqlslap.exe
-a---        11-02-2022  02:22 AM        3546288 ﬓ  perror.exe
-a---        11-02-2022  02:22 AM        3398832 ﬓ  replace.exe
-a---        11-02-2022  02:23 AM        1447600 ﬓ  sst_dump.exe
-a---        02-12-2020  11:01 AM        1035728   ucrtbase.dll
-a---        08-05-2020  04:46 PM          44320   vcruntime140_1.dll

  bin    .\mysql -u root -p
Enter password:
Welcome to the MariaDB monitor.  Commands end with ; or \g.
Your MariaDB connection id is 8
Server version: 10.4.24-MariaDB mariadb.org binary distribution

Copyright (c) 2000, 2018, Oracle, MariaDB Corporation Ab and others.

Type 'help;' or '\h' for help. Type '\c' to clear the current input statement.

MariaDB [(none)]> clear
MariaDB [(none)]> ls
    -> ^X
    -> ^Z
    ->
    ->
    ->
    ->
    ->
    ->
    -> ls
    -> lsls
    -> ^Z^Z^Z^Z^Z^Z
    ->
    ->
    -> Bye
Ctrl-C -- exit!
  bin    ^C
  bin   
> ^C
  bin    .\mysql -u root -p
Enter password:
Welcome to the MariaDB monitor.  Commands end with ; or \g.
Your MariaDB connection id is 9
Server version: 10.4.24-MariaDB mariadb.org binary distribution

Copyright (c) 2000, 2018, Oracle, MariaDB Corporation Ab and others.

Type 'help;' or '\h' for help. Type '\c' to clear the current input statement.

MariaDB [(none)]> show database
    -> Bye
Ctrl-C -- exit!
  bin    .\mysql -u root -p
Enter password:
Welcome to the MariaDB monitor.  Commands end with ; or \g.
Your MariaDB connection id is 10
Server version: 10.4.24-MariaDB mariadb.org binary distribution

Copyright (c) 2000, 2018, Oracle, MariaDB Corporation Ab and others.

Type 'help;' or '\h' for help. Type '\c' to clear the current input statement.

MariaDB [(none)]> show database;
ERROR 1064 (42000): You have an error in your SQL syntax; check the manual that corresponds to your MariaDB server version for the right syntax to use near 'database' at line 1
MariaDB [(none)]> cls
    -> ;
ERROR 1064 (42000): You have an error in your SQL syntax; check the manual that corresponds to your MariaDB server version for the right syntax to use near 'cls' at line 1
MariaDB [(none)]> clear;
MariaDB [(none)]> clrscr;
ERROR 1064 (42000): You have an error in your SQL syntax; check the manual that corresponds to your MariaDB server version for the right syntax to use near 'clrscr' at line 1
MariaDB [(none)]> cls;
ERROR 1064 (42000): You have an error in your SQL syntax; check the manual that corresponds to your MariaDB server version for the right syntax to use near 'cls' at line 1
MariaDB [(none)]> show databases;
+--------------------+
| Database           |
+--------------------+
| information_schema |
| mysql              |
| performance_schema |
| phpmyadmin         |
| railwayticket_415  |
| test               |
+--------------------+
6 rows in set (0.055 sec)

MariaDB [(none)]> create database company;
Query OK, 1 row affected (0.010 sec)

MariaDB [(none)]> show databases;
+--------------------+
| Database           |
+--------------------+
| company            |
| information_schema |
| mysql              |
| performance_schema |
| phpmyadmin         |
| railwayticket_415  |
| test               |
+--------------------+
7 rows in set (0.001 sec)

MariaDB [(none)]> use company
Database changed
MariaDB [company]> CREATE TABLE employee (
    -> emp_id INT PRIMARY KEY,
    -> first_name VARCHAR(40),
    -> last_name VARCHAR(40),
    -> birth_day DATE,
    -> gender VARCHAR(1),
    -> salary INT,
    -> super_id INT,
    -> branch_id INT
    -> );
Query OK, 0 rows affected (0.056 sec)

MariaDB [company]> CREATE TABLE branch (
    -> branch_id INT PRIMARY KEY,
    -> branch_name VARCHAR(40),
    -> mgr_id INT,
    -> mgr_start_date DATE,
    -> FOREIGN KEY(mgr_id) REFERENCES employee(emp_id) ON DELETE SET NULL
    -> );
Query OK, 0 rows affected (0.043 sec)

MariaDB [company]> ALTER TABLE employee
    -> ADD FOREIGN KEY(branch_id)
    -> REFERENCES branch(branch_id)
    -> ON DELETE SET NULL;
Query OK, 0 rows affected (0.094 sec)
Records: 0  Duplicates: 0  Warnings: 0

MariaDB [company]> ALTER TABLE employee
    -> ADD FOREIGN KEY(super_id)
    -> REFERENCES employee(emp_id)
    -> ON DELETE SET NULL;
Query OK, 0 rows affected (0.117 sec)
Records: 0  Duplicates: 0  Warnings: 0

MariaDB [company]> show database;
ERROR 1064 (42000): You have an error in your SQL syntax; check the manual that corresponds to your MariaDB server version for the right syntax to use near 'database' at line 1
MariaDB [company]> show databases;
+--------------------+
| Database           |
+--------------------+
| company            |
| information_schema |
| mysql              |
| performance_schema |
| phpmyadmin         |
| railwayticket_415  |
| test               |
+--------------------+
7 rows in set (0.001 sec)

MariaDB [company]> CREATE TABLE client (
    -> client_id INT PRIMARY KEY,
    ->
    -> client_name VARCHAR(40),
    -> branch_id INT,
    -> FOREIGN KEY(branch_id) REFERENCES branch(branch_id) ON DELETE SET NULL
    -> );
Query OK, 0 rows affected (0.048 sec)

MariaDB [company]> CREATE TABLE works_with (
    -> emp_id INT,
    -> client_id INT,
    -> total_sales INT,
    -> PRIMARY KEY(emp_id, client_id),
    -> FOREIGN KEY(emp_id) REFERENCES employee(emp_id) ON DELETE CASCADE,
    -> FOREIGN KEY(client_id) REFERENCES client(client_id) ON DELETE CASCADE
    -> );
Query OK, 0 rows affected (0.047 sec)

MariaDB [company]> CREATE TABLE branch_supplier (
    -> branch_id INT,
    -> supplier_name VARCHAR(40),
    -> supply_type VARCHAR(40),
    -> PRIMARY KEY(branch_id, supplier_name),
    -> FOREIGN KEY(branch_id) REFERENCES branch(branch_id) ON DELETE CASCADE
    -> );
Query OK, 0 rows affected (0.052 sec)

MariaDB [company]> INSERT INTO employee VALUES(100, &#39;David&#39;, &#39;Wallace&#39;, &#39;1967-11-17&#39;, &#39;M&#39;, 250000, NULL, NULL);
    ->
    ->
    -> ;
ERROR 1064 (42000): You have an error in your SQL syntax; check the manual that corresponds to your MariaDB server version for the right syntax to use near '&' at line 1
MariaDB [company]> INSERT INTO employee VALUES(100, &#39;David&#39;, &#39;Wallace&#39;, &#39;1967-11-17&#39;, &#39;M&#39;, 250000, NULL, NULL);INSERT INTO employee VALUES(100, 'David', 'Wallace', '1967-11-17', 'M', 250000, NULL, NULL);
    -> ;
ERROR 1064 (42000): You have an error in your SQL syntax; check the manual that corresponds to your MariaDB server version for the right syntax to use near '&' at line 1
MariaDB [company]> NSERT INTO employee VALUES(100, 'David', 'Wallace', '1967-11-17', 'M', 250000, NULL, NULL);
ERROR 1064 (42000): You have an error in your SQL syntax; check the manual that corresponds to your MariaDB server version for the right syntax to use near 'NSERT INTO employee VALUES(100, 'David', 'Wallace', '1967-11-17', 'M', 250000...' at line 1
MariaDB [company]> INSERT INTO employee VALUES(100, 'David', 'Wallace', '1967-11-17', 'M', 250000, NULL, NULL);
Query OK, 1 row affected (0.086 sec)

MariaDB [company]> INSERT INTO branch VALUES(1, 'Corporate', 100, '2006-02-09');
Query OK, 1 row affected (0.008 sec)

MariaDB [company]> Update employee;
ERROR 1064 (42000): You have an error in your SQL syntax; check the manual that corresponds to your MariaDB server version for the right syntax to use near '' at line 1
MariaDB [company]> set branch_id=1;
ERROR 1193 (HY000): Unknown system variable 'branch_id'
MariaDB [company]> UPDATE employee SET branch_id=1 WHERE emp_id=100;
Query OK, 1 row affected (0.014 sec)
Rows matched: 1  Changed: 1  Warnings: 0

MariaDB [company]> select * from employee;
+--------+------------+-----------+------------+--------+--------+----------+-----------+
| emp_id | first_name | last_name | birth_day  | gender | salary | super_id | branch_id |
+--------+------------+-----------+------------+--------+--------+----------+-----------+
|    100 | David      | Wallace   | 1967-11-17 | M      | 250000 |     NULL |         1 |
+--------+------------+-----------+------------+--------+--------+----------+-----------+
1 row in set (0.004 sec)

MariaDB [company]>
MariaDB [company]> INSERT INTO employee VALUES(101, 'Jan', 'Levinson', '1961-05-11', 'F', 110000, 100, 1);
Query OK, 1 row affected (0.008 sec)

MariaDB [company]> INSERT INTO employee VALUES(102, 'Michael', 'Scott', '1964-03-15', 'M', 75000, 100, NULL);
Query OK, 1 row affected (0.012 sec)

MariaDB [company]>
MariaDB [company]> INSERT INTO branch VALUES(2, 'Scranton', 102, '1992-04-06');
Query OK, 1 row affected (0.008 sec)

MariaDB [company]> UPDATE employee SET branch_id=2 where emp_id=102;
Query OK, 1 row affected (0.008 sec)
Rows matched: 1  Changed: 1  Warnings: 0

MariaDB [company]> select * from employee;
+--------+------------+-----------+------------+--------+--------+----------+-----------+
| emp_id | first_name | last_name | birth_day  | gender | salary | super_id | branch_id |
+--------+------------+-----------+------------+--------+--------+----------+-----------+
|    100 | David      | Wallace   | 1967-11-17 | M      | 250000 |     NULL |         1 |
|    101 | Jan        | Levinson  | 1961-05-11 | F      | 110000 |      100 |         1 |
|    102 | Michael    | Scott     | 1964-03-15 | M      |  75000 |      100 |         2 |
+--------+------------+-----------+------------+--------+--------+----------+-----------+
3 rows in set (0.000 sec)

MariaDB [company]> INSERT INTO employee VALUES(103, 'Angela', 'Martin', '1971-06-25', 'F', 63000, 102, 2);
Query OK, 1 row affected (0.012 sec)

MariaDB [company]> INSERT INTO employee VALUES(104, 'Kelly', 'Kapoor', '1980-02-05', 'F', 55000, 102, 2);
Query OK, 1 row affected (0.025 sec)

MariaDB [company]> INSERT INTO employee VALUES(105, 'Stanley', 'Hudson', '1958-02-19', 'M', 69000, 102, 2);
Query OK, 1 row affected (0.009 sec)

MariaDB [company]> INSERT INTO employee VALUES(106, 'Josh', 'Porter', '1969-09-05', 'M', 78000, 100, NULL);
Query OK, 1 row affected (0.010 sec)

MariaDB [company]>
MariaDB [company]> INSERT INTO branch VALUES(3, 'Stamford', 106, '1998-02-13');
Query OK, 1 row affected (0.007 sec)

MariaDB [company]>
MariaDB [company]> UPDATE employee
    -> SET branch_id = 3
    -> WHERE emp_id = 106;
Query OK, 1 row affected (0.009 sec)
Rows matched: 1  Changed: 1  Warnings: 0

MariaDB [company]>
MariaDB [company]> INSERT INTO employee VALUES(107, 'Andy', 'Bernard', '1973-07-22', 'M', 65000, 106, 3);
Query OK, 1 row affected (0.013 sec)

MariaDB [company]> INSERT INTO employee VALUES(108, 'Jim', 'Halpert', '1978-10-01', 'M', 71000, 106, 3);
Query OK, 1 row affected (0.007 sec)

MariaDB [company]> INSERT INTO branch_supplier VALUES(2, 'Hammer Mill', 'Paper');
Query OK, 1 row affected (0.022 sec)

MariaDB [company]> INSERT INTO branch_supplier VALUES(2, 'Uni-ball', 'Writing Utensils');
Query OK, 1 row affected (0.012 sec)

MariaDB [company]> INSERT INTO branch_supplier VALUES(3, 'Patriot Paper', 'Paper');
Query OK, 1 row affected (0.005 sec)

MariaDB [company]> INSERT INTO branch_supplier VALUES(2, 'J.T. Forms & Labels', 'Custom Forms');
Query OK, 1 row affected (0.001 sec)

MariaDB [company]> INSERT INTO branch_supplier VALUES(3, 'Uni-ball', 'Writing Utensils');
Query OK, 1 row affected (0.001 sec)

MariaDB [company]> INSERT INTO branch_supplier VALUES(3, 'Hammer Mill', 'Paper');
Query OK, 1 row affected (0.001 sec)

MariaDB [company]> INSERT INTO branch_supplier VALUES(3, 'Stamford Lables', 'Custom Forms');
Query OK, 1 row affected (0.001 sec)

MariaDB [company]> INSERT INTO client VALUES(400, 'Dunmore Highschool', 2);
Query OK, 1 row affected (0.010 sec)

MariaDB [company]> INSERT INTO client VALUES(401, 'Lackawana Country', 2);
Query OK, 1 row affected (0.001 sec)

MariaDB [company]> INSERT INTO client VALUES(402, 'FedEx', 3);
Query OK, 1 row affected (0.001 sec)

MariaDB [company]> INSERT INTO client VALUES(403, 'John Daly Law, LLC', 3);
Query OK, 1 row affected (0.001 sec)

MariaDB [company]> INSERT INTO client VALUES(404, 'Scranton Whitepages', 2);
Query OK, 1 row affected (0.001 sec)

MariaDB [company]> INSERT INTO client VALUES(405, 'Times Newspaper', 3);
Query OK, 1 row affected (0.001 sec)

MariaDB [company]> INSERT INTO client VALUES(406, 'FedEx', 2);
Query OK, 1 row affected (0.002 sec)

MariaDB [company]> INSERT INTO works_with VALUES(105, 400, 55000);
Query OK, 1 row affected (0.006 sec)

MariaDB [company]> INSERT INTO works_with VALUES(102, 401, 267000);
Query OK, 1 row affected (0.001 sec)

MariaDB [company]> INSERT INTO works_with VALUES(108, 402, 22500);
Query OK, 1 row affected (0.002 sec)

MariaDB [company]> INSERT INTO works_with VALUES(107, 403, 5000);
Query OK, 1 row affected (0.001 sec)

MariaDB [company]> INSERT INTO works_with VALUES(108, 403, 12000);
Query OK, 1 row affected (0.001 sec)

MariaDB [company]> INSERT INTO works_with VALUES(105, 404, 33000);
Query OK, 1 row affected (0.001 sec)

MariaDB [company]> INSERT INTO works_with VALUES(107, 405, 26000);
Query OK, 1 row affected (0.001 sec)

MariaDB [company]> INSERT INTO works_with VALUES(102, 406, 15000);
Query OK, 1 row affected (0.001 sec)

MariaDB [company]> INSERT INTO works_with VALUES(105, 406, 13
    -> );
Query OK, 1 row affected (0.003 sec)

MariaDB [company]> select * from company
    -> ;
ERROR 1146 (42S02): Table 'company.company' doesn't exist
MariaDB [company]> select * from employee;
+--------+------------+-----------+------------+--------+--------+----------+-----------+
| emp_id | first_name | last_name | birth_day  | gender | salary | super_id | branch_id |
+--------+------------+-----------+------------+--------+--------+----------+-----------+
|    100 | David      | Wallace   | 1967-11-17 | M      | 250000 |     NULL |         1 |
|    101 | Jan        | Levinson  | 1961-05-11 | F      | 110000 |      100 |         1 |
|    102 | Michael    | Scott     | 1964-03-15 | M      |  75000 |      100 |         2 |
|    103 | Angela     | Martin    | 1971-06-25 | F      |  63000 |      102 |         2 |
|    104 | Kelly      | Kapoor    | 1980-02-05 | F      |  55000 |      102 |         2 |
|    105 | Stanley    | Hudson    | 1958-02-19 | M      |  69000 |      102 |         2 |
|    106 | Josh       | Porter    | 1969-09-05 | M      |  78000 |      100 |         3 |
|    107 | Andy       | Bernard   | 1973-07-22 | M      |  65000 |      106 |         3 |
|    108 | Jim        | Halpert   | 1978-10-01 | M      |  71000 |      106 |         3 |
+--------+------------+-----------+------------+--------+--------+----------+-----------+
9 rows in set (0.000 sec)

MariaDB [company]> select * from employee,client;
+--------+------------+-----------+------------+--------+--------+----------+-----------+-----------+---------------------+-----------+
| emp_id | first_name | last_name | birth_day  | gender | salary | super_id | branch_id | client_id | client_name         | branch_id |
+--------+------------+-----------+------------+--------+--------+----------+-----------+-----------+---------------------+-----------+
|    100 | David      | Wallace   | 1967-11-17 | M      | 250000 |     NULL |         1 |       400 | Dunmore Highschool  |         2 |
|    100 | David      | Wallace   | 1967-11-17 | M      | 250000 |     NULL |         1 |       401 | Lackawana Country   |         2 |
|    100 | David      | Wallace   | 1967-11-17 | M      | 250000 |     NULL |         1 |       402 | FedEx               |         3 |
|    100 | David      | Wallace   | 1967-11-17 | M      | 250000 |     NULL |         1 |       403 | John Daly Law, LLC  |         3 |
|    100 | David      | Wallace   | 1967-11-17 | M      | 250000 |     NULL |         1 |       404 | Scranton Whitepages |         2 |
|    100 | David      | Wallace   | 1967-11-17 | M      | 250000 |     NULL |         1 |       405 | Times Newspaper     |         3 |
|    100 | David      | Wallace   | 1967-11-17 | M      | 250000 |     NULL |         1 |       406 | FedEx               |         2 |
|    101 | Jan        | Levinson  | 1961-05-11 | F      | 110000 |      100 |         1 |       400 | Dunmore Highschool  |         2 |
|    101 | Jan        | Levinson  | 1961-05-11 | F      | 110000 |      100 |         1 |       401 | Lackawana Country   |         2 |
|    101 | Jan        | Levinson  | 1961-05-11 | F      | 110000 |      100 |         1 |       402 | FedEx               |         3 |
|    101 | Jan        | Levinson  | 1961-05-11 | F      | 110000 |      100 |         1 |       403 | John Daly Law, LLC  |         3 |
|    101 | Jan        | Levinson  | 1961-05-11 | F      | 110000 |      100 |         1 |       404 | Scranton Whitepages |         2 |
|    101 | Jan        | Levinson  | 1961-05-11 | F      | 110000 |      100 |         1 |       405 | Times Newspaper     |         3 |
|    101 | Jan        | Levinson  | 1961-05-11 | F      | 110000 |      100 |         1 |       406 | FedEx               |         2 |
|    102 | Michael    | Scott     | 1964-03-15 | M      |  75000 |      100 |         2 |       400 | Dunmore Highschool  |         2 |
|    102 | Michael    | Scott     | 1964-03-15 | M      |  75000 |      100 |         2 |       401 | Lackawana Country   |         2 |
|    102 | Michael    | Scott     | 1964-03-15 | M      |  75000 |      100 |         2 |       402 | FedEx               |         3 |
|    102 | Michael    | Scott     | 1964-03-15 | M      |  75000 |      100 |         2 |       403 | John Daly Law, LLC  |         3 |
|    102 | Michael    | Scott     | 1964-03-15 | M      |  75000 |      100 |         2 |       404 | Scranton Whitepages |         2 |
|    102 | Michael    | Scott     | 1964-03-15 | M      |  75000 |      100 |         2 |       405 | Times Newspaper     |         3 |
|    102 | Michael    | Scott     | 1964-03-15 | M      |  75000 |      100 |         2 |       406 | FedEx               |         2 |
|    103 | Angela     | Martin    | 1971-06-25 | F      |  63000 |      102 |         2 |       400 | Dunmore Highschool  |         2 |
|    103 | Angela     | Martin    | 1971-06-25 | F      |  63000 |      102 |         2 |       401 | Lackawana Country   |         2 |
|    103 | Angela     | Martin    | 1971-06-25 | F      |  63000 |      102 |         2 |       402 | FedEx               |         3 |
|    103 | Angela     | Martin    | 1971-06-25 | F      |  63000 |      102 |         2 |       403 | John Daly Law, LLC  |         3 |
|    103 | Angela     | Martin    | 1971-06-25 | F      |  63000 |      102 |         2 |       404 | Scranton Whitepages |         2 |
|    103 | Angela     | Martin    | 1971-06-25 | F      |  63000 |      102 |         2 |       405 | Times Newspaper     |         3 |
|    103 | Angela     | Martin    | 1971-06-25 | F      |  63000 |      102 |         2 |       406 | FedEx               |         2 |
|    104 | Kelly      | Kapoor    | 1980-02-05 | F      |  55000 |      102 |         2 |       400 | Dunmore Highschool  |         2 |
|    104 | Kelly      | Kapoor    | 1980-02-05 | F      |  55000 |      102 |         2 |       401 | Lackawana Country   |         2 |
|    104 | Kelly      | Kapoor    | 1980-02-05 | F      |  55000 |      102 |         2 |       402 | FedEx               |         3 |
|    104 | Kelly      | Kapoor    | 1980-02-05 | F      |  55000 |      102 |         2 |       403 | John Daly Law, LLC  |         3 |
|    104 | Kelly      | Kapoor    | 1980-02-05 | F      |  55000 |      102 |         2 |       404 | Scranton Whitepages |         2 |
|    104 | Kelly      | Kapoor    | 1980-02-05 | F      |  55000 |      102 |         2 |       405 | Times Newspaper     |         3 |
|    104 | Kelly      | Kapoor    | 1980-02-05 | F      |  55000 |      102 |         2 |       406 | FedEx               |         2 |
|    105 | Stanley    | Hudson    | 1958-02-19 | M      |  69000 |      102 |         2 |       400 | Dunmore Highschool  |         2 |
|    105 | Stanley    | Hudson    | 1958-02-19 | M      |  69000 |      102 |         2 |       401 | Lackawana Country   |         2 |
|    105 | Stanley    | Hudson    | 1958-02-19 | M      |  69000 |      102 |         2 |       402 | FedEx               |         3 |
|    105 | Stanley    | Hudson    | 1958-02-19 | M      |  69000 |      102 |         2 |       403 | John Daly Law, LLC  |         3 |
|    105 | Stanley    | Hudson    | 1958-02-19 | M      |  69000 |      102 |         2 |       404 | Scranton Whitepages |         2 |
|    105 | Stanley    | Hudson    | 1958-02-19 | M      |  69000 |      102 |         2 |       405 | Times Newspaper     |         3 |
|    105 | Stanley    | Hudson    | 1958-02-19 | M      |  69000 |      102 |         2 |       406 | FedEx               |         2 |
|    106 | Josh       | Porter    | 1969-09-05 | M      |  78000 |      100 |         3 |       400 | Dunmore Highschool  |         2 |
|    106 | Josh       | Porter    | 1969-09-05 | M      |  78000 |      100 |         3 |       401 | Lackawana Country   |         2 |
|    106 | Josh       | Porter    | 1969-09-05 | M      |  78000 |      100 |         3 |       402 | FedEx               |         3 |
|    106 | Josh       | Porter    | 1969-09-05 | M      |  78000 |      100 |         3 |       403 | John Daly Law, LLC  |         3 |
|    106 | Josh       | Porter    | 1969-09-05 | M      |  78000 |      100 |         3 |       404 | Scranton Whitepages |         2 |
|    106 | Josh       | Porter    | 1969-09-05 | M      |  78000 |      100 |         3 |       405 | Times Newspaper     |         3 |
|    106 | Josh       | Porter    | 1969-09-05 | M      |  78000 |      100 |         3 |       406 | FedEx               |         2 |
|    107 | Andy       | Bernard   | 1973-07-22 | M      |  65000 |      106 |         3 |       400 | Dunmore Highschool  |         2 |
|    107 | Andy       | Bernard   | 1973-07-22 | M      |  65000 |      106 |         3 |       401 | Lackawana Country   |         2 |
|    107 | Andy       | Bernard   | 1973-07-22 | M      |  65000 |      106 |         3 |       402 | FedEx               |         3 |
|    107 | Andy       | Bernard   | 1973-07-22 | M      |  65000 |      106 |         3 |       403 | John Daly Law, LLC  |         3 |
|    107 | Andy       | Bernard   | 1973-07-22 | M      |  65000 |      106 |         3 |       404 | Scranton Whitepages |         2 |
|    107 | Andy       | Bernard   | 1973-07-22 | M      |  65000 |      106 |         3 |       405 | Times Newspaper     |         3 |
|    107 | Andy       | Bernard   | 1973-07-22 | M      |  65000 |      106 |         3 |       406 | FedEx               |         2 |
|    108 | Jim        | Halpert   | 1978-10-01 | M      |  71000 |      106 |         3 |       400 | Dunmore Highschool  |         2 |
|    108 | Jim        | Halpert   | 1978-10-01 | M      |  71000 |      106 |         3 |       401 | Lackawana Country   |         2 |
|    108 | Jim        | Halpert   | 1978-10-01 | M      |  71000 |      106 |         3 |       402 | FedEx               |         3 |
|    108 | Jim        | Halpert   | 1978-10-01 | M      |  71000 |      106 |         3 |       403 | John Daly Law, LLC  |         3 |
|    108 | Jim        | Halpert   | 1978-10-01 | M      |  71000 |      106 |         3 |       404 | Scranton Whitepages |         2 |
|    108 | Jim        | Halpert   | 1978-10-01 | M      |  71000 |      106 |         3 |       405 | Times Newspaper     |         3 |
|    108 | Jim        | Halpert   | 1978-10-01 | M      |  71000 |      106 |         3 |       406 | FedEx               |         2 |
+--------+------------+-----------+------------+--------+--------+----------+-----------+-----------+---------------------+-----------+
63 rows in set (0.003 sec)

MariaDB [company]> select * from employee*client;
ERROR 1064 (42000): You have an error in your SQL syntax; check the manual that corresponds to your MariaDB server version for the right syntax to use near '*client' at line 1
MariaDB [company]> select * from employee;
+--------+------------+-----------+------------+--------+--------+----------+-----------+
| emp_id | first_name | last_name | birth_day  | gender | salary | super_id | branch_id |
+--------+------------+-----------+------------+--------+--------+----------+-----------+
|    100 | David      | Wallace   | 1967-11-17 | M      | 250000 |     NULL |         1 |
|    101 | Jan        | Levinson  | 1961-05-11 | F      | 110000 |      100 |         1 |
|    102 | Michael    | Scott     | 1964-03-15 | M      |  75000 |      100 |         2 |
|    103 | Angela     | Martin    | 1971-06-25 | F      |  63000 |      102 |         2 |
|    104 | Kelly      | Kapoor    | 1980-02-05 | F      |  55000 |      102 |         2 |
|    105 | Stanley    | Hudson    | 1958-02-19 | M      |  69000 |      102 |         2 |
|    106 | Josh       | Porter    | 1969-09-05 | M      |  78000 |      100 |         3 |
|    107 | Andy       | Bernard   | 1973-07-22 | M      |  65000 |      106 |         3 |
|    108 | Jim        | Halpert   | 1978-10-01 | M      |  71000 |      106 |         3 |
+--------+------------+-----------+------------+--------+--------+----------+-----------+
9 rows in set (0.000 sec)

MariaDB [company]> select * from client;
+-----------+---------------------+-----------+
| client_id | client_name         | branch_id |
+-----------+---------------------+-----------+
|       400 | Dunmore Highschool  |         2 |
|       401 | Lackawana Country   |         2 |
|       402 | FedEx               |         3 |
|       403 | John Daly Law, LLC  |         3 |
|       404 | Scranton Whitepages |         2 |
|       405 | Times Newspaper     |         3 |
|       406 | FedEx               |         2 |
+-----------+---------------------+-----------+
7 rows in set (0.000 sec)

MariaDB [company]> select * from works_with;
+--------+-----------+-------------+
| emp_id | client_id | total_sales |
+--------+-----------+-------------+
|    102 |       401 |      267000 |
|    102 |       406 |       15000 |
|    105 |       400 |       55000 |
|    105 |       404 |       33000 |
|    105 |       406 |          13 |
|    107 |       403 |        5000 |
|    107 |       405 |       26000 |
|    108 |       402 |       22500 |
|    108 |       403 |       12000 |
+--------+-----------+-------------+
9 rows in set (0.000 sec)

MariaDB [company]> select * from branch_supplier;
+-----------+---------------------+------------------+
| branch_id | supplier_name       | supply_type      |
+-----------+---------------------+------------------+
|         2 | Hammer Mill         | Paper            |
|         2 | J.T. Forms & Labels | Custom Forms     |
|         2 | Uni-ball            | Writing Utensils |
|         3 | Hammer Mill         | Paper            |
|         3 | Patriot Paper       | Paper            |
|         3 | Stamford Lables     | Custom Forms     |
|         3 | Uni-ball            | Writing Utensils |
+-----------+---------------------+------------------+
7 rows in set (0.000 sec)

MariaDB [company]> select * from employee Orderby salary DESC;
ERROR 1064 (42000): You have an error in your SQL syntax; check the manual that corresponds to your MariaDB server version for the right syntax to use near 'salary DESC' at line 1
MariaDB [company]> select * from employee Orderby salary DES;
ERROR 1064 (42000): You have an error in your SQL syntax; check the manual that corresponds to your MariaDB server version for the right syntax to use near 'salary DES' at line 1
MariaDB [company]> select * from employee Order by salary DES;
ERROR 1064 (42000): You have an error in your SQL syntax; check the manual that corresponds to your MariaDB server version for the right syntax to use near 'DES' at line 1
MariaDB [company]> select * from employee Order by salary DESc;
+--------+------------+-----------+------------+--------+--------+----------+-----------+
| emp_id | first_name | last_name | birth_day  | gender | salary | super_id | branch_id |
+--------+------------+-----------+------------+--------+--------+----------+-----------+
|    100 | David      | Wallace   | 1967-11-17 | M      | 250000 |     NULL |         1 |
|    101 | Jan        | Levinson  | 1961-05-11 | F      | 110000 |      100 |         1 |
|    106 | Josh       | Porter    | 1969-09-05 | M      |  78000 |      100 |         3 |
|    102 | Michael    | Scott     | 1964-03-15 | M      |  75000 |      100 |         2 |
|    108 | Jim        | Halpert   | 1978-10-01 | M      |  71000 |      106 |         3 |
|    105 | Stanley    | Hudson    | 1958-02-19 | M      |  69000 |      102 |         2 |
|    107 | Andy       | Bernard   | 1973-07-22 | M      |  65000 |      106 |         3 |
|    103 | Angela     | Martin    | 1971-06-25 | F      |  63000 |      102 |         2 |
|    104 | Kelly      | Kapoor    | 1980-02-05 | F      |  55000 |      102 |         2 |
+--------+------------+-----------+------------+--------+--------+----------+-----------+
9 rows in set (0.003 sec)

MariaDB [company]> select * from employee Order by gender;
+--------+------------+-----------+------------+--------+--------+----------+-----------+
| emp_id | first_name | last_name | birth_day  | gender | salary | super_id | branch_id |
+--------+------------+-----------+------------+--------+--------+----------+-----------+
|    101 | Jan        | Levinson  | 1961-05-11 | F      | 110000 |      100 |         1 |
|    103 | Angela     | Martin    | 1971-06-25 | F      |  63000 |      102 |         2 |
|    104 | Kelly      | Kapoor    | 1980-02-05 | F      |  55000 |      102 |         2 |
|    100 | David      | Wallace   | 1967-11-17 | M      | 250000 |     NULL |         1 |
|    102 | Michael    | Scott     | 1964-03-15 | M      |  75000 |      100 |         2 |
|    105 | Stanley    | Hudson    | 1958-02-19 | M      |  69000 |      102 |         2 |
|    106 | Josh       | Porter    | 1969-09-05 | M      |  78000 |      100 |         3 |
|    107 | Andy       | Bernard   | 1973-07-22 | M      |  65000 |      106 |         3 |
|    108 | Jim        | Halpert   | 1978-10-01 | M      |  71000 |      106 |         3 |
+--------+------------+-----------+------------+--------+--------+----------+-----------+
9 rows in set (0.000 sec)

MariaDB [company]> select * from employee Order by gender DESC;
+--------+------------+-----------+------------+--------+--------+----------+-----------+
| emp_id | first_name | last_name | birth_day  | gender | salary | super_id | branch_id |
+--------+------------+-----------+------------+--------+--------+----------+-----------+
|    100 | David      | Wallace   | 1967-11-17 | M      | 250000 |     NULL |         1 |
|    102 | Michael    | Scott     | 1964-03-15 | M      |  75000 |      100 |         2 |
|    105 | Stanley    | Hudson    | 1958-02-19 | M      |  69000 |      102 |         2 |
|    106 | Josh       | Porter    | 1969-09-05 | M      |  78000 |      100 |         3 |
|    107 | Andy       | Bernard   | 1973-07-22 | M      |  65000 |      106 |         3 |
|    108 | Jim        | Halpert   | 1978-10-01 | M      |  71000 |      106 |         3 |
|    101 | Jan        | Levinson  | 1961-05-11 | F      | 110000 |      100 |         1 |
|    103 | Angela     | Martin    | 1971-06-25 | F      |  63000 |      102 |         2 |
|    104 | Kelly      | Kapoor    | 1980-02-05 | F      |  55000 |      102 |         2 |
+--------+------------+-----------+------------+--------+--------+----------+-----------+
9 rows in set (0.000 sec)

MariaDB [company]> select * from employee Order by salary ASC/DESc;
ERROR 1064 (42000): You have an error in your SQL syntax; check the manual that corresponds to your MariaDB server version for the right syntax to use near '/DESc' at line 1
MariaDB [company]> select * from employee Order by salary ASC/DESC;
ERROR 1064 (42000): You have an error in your SQL syntax; check the manual that corresponds to your MariaDB server version for the right syntax to use near '/DESC' at line 1
MariaDB [company]> select * from employee Order by salary ASC;
+--------+------------+-----------+------------+--------+--------+----------+-----------+
| emp_id | first_name | last_name | birth_day  | gender | salary | super_id | branch_id |
+--------+------------+-----------+------------+--------+--------+----------+-----------+
|    104 | Kelly      | Kapoor    | 1980-02-05 | F      |  55000 |      102 |         2 |
|    103 | Angela     | Martin    | 1971-06-25 | F      |  63000 |      102 |         2 |
|    107 | Andy       | Bernard   | 1973-07-22 | M      |  65000 |      106 |         3 |
|    105 | Stanley    | Hudson    | 1958-02-19 | M      |  69000 |      102 |         2 |
|    108 | Jim        | Halpert   | 1978-10-01 | M      |  71000 |      106 |         3 |
|    102 | Michael    | Scott     | 1964-03-15 | M      |  75000 |      100 |         2 |
|    106 | Josh       | Porter    | 1969-09-05 | M      |  78000 |      100 |         3 |
|    101 | Jan        | Levinson  | 1961-05-11 | F      | 110000 |      100 |         1 |
|    100 | David      | Wallace   | 1967-11-17 | M      | 250000 |     NULL |         1 |
+--------+------------+-----------+------------+--------+--------+----------+-----------+
9 rows in set (0.000 sec)

MariaDB [company]> select * from employee order by gender,name;
ERROR 1054 (42S22): Unknown column 'name' in 'order clause'
MariaDB [company]> select * from employee order by gender, name;
ERROR 1054 (42S22): Unknown column 'name' in 'order clause'
MariaDB [company]> select * from employee order by gender, first_name;
+--------+------------+-----------+------------+--------+--------+----------+-----------+
| emp_id | first_name | last_name | birth_day  | gender | salary | super_id | branch_id |
+--------+------------+-----------+------------+--------+--------+----------+-----------+
|    103 | Angela     | Martin    | 1971-06-25 | F      |  63000 |      102 |         2 |
|    101 | Jan        | Levinson  | 1961-05-11 | F      | 110000 |      100 |         1 |
|    104 | Kelly      | Kapoor    | 1980-02-05 | F      |  55000 |      102 |         2 |
|    107 | Andy       | Bernard   | 1973-07-22 | M      |  65000 |      106 |         3 |
|    100 | David      | Wallace   | 1967-11-17 | M      | 250000 |     NULL |         1 |
|    108 | Jim        | Halpert   | 1978-10-01 | M      |  71000 |      106 |         3 |
|    106 | Josh       | Porter    | 1969-09-05 | M      |  78000 |      100 |         3 |
|    102 | Michael    | Scott     | 1964-03-15 | M      |  75000 |      100 |         2 |
|    105 | Stanley    | Hudson    | 1958-02-19 | M      |  69000 |      102 |         2 |
+--------+------------+-----------+------------+--------+--------+----------+-----------+
9 rows in set (0.000 sec)

MariaDB [company]> select * from employee order by gender, first_name, last_name;
+--------+------------+-----------+------------+--------+--------+----------+-----------+
| emp_id | first_name | last_name | birth_day  | gender | salary | super_id | branch_id |
+--------+------------+-----------+------------+--------+--------+----------+-----------+
|    103 | Angela     | Martin    | 1971-06-25 | F      |  63000 |      102 |         2 |
|    101 | Jan        | Levinson  | 1961-05-11 | F      | 110000 |      100 |         1 |
|    104 | Kelly      | Kapoor    | 1980-02-05 | F      |  55000 |      102 |         2 |
|    107 | Andy       | Bernard   | 1973-07-22 | M      |  65000 |      106 |         3 |
|    100 | David      | Wallace   | 1967-11-17 | M      | 250000 |     NULL |         1 |
|    108 | Jim        | Halpert   | 1978-10-01 | M      |  71000 |      106 |         3 |
|    106 | Josh       | Porter    | 1969-09-05 | M      |  78000 |      100 |         3 |
|    102 | Michael    | Scott     | 1964-03-15 | M      |  75000 |      100 |         2 |
|    105 | Stanley    | Hudson    | 1958-02-19 | M      |  69000 |      102 |         2 |
+--------+------------+-----------+------------+--------+--------+----------+-----------+
9 rows in set (0.000 sec)

MariaDB [company]> select * from employee LIMIT 5;
+--------+------------+-----------+------------+--------+--------+----------+-----------+
| emp_id | first_name | last_name | birth_day  | gender | salary | super_id | branch_id |
+--------+------------+-----------+------------+--------+--------+----------+-----------+
|    100 | David      | Wallace   | 1967-11-17 | M      | 250000 |     NULL |         1 |
|    101 | Jan        | Levinson  | 1961-05-11 | F      | 110000 |      100 |         1 |
|    102 | Michael    | Scott     | 1964-03-15 | M      |  75000 |      100 |         2 |
|    103 | Angela     | Martin    | 1971-06-25 | F      |  63000 |      102 |         2 |
|    104 | Kelly      | Kapoor    | 1980-02-05 | F      |  55000 |      102 |         2 |
+--------+------------+-----------+------------+--------+--------+----------+-----------+
5 rows in set (0.000 sec)

MariaDB [company]> select first_name, employee.lastname from employee;
ERROR 1054 (42S22): Unknown column 'employee.lastname' in 'field list'
MariaDB [company]> select first_name, employee.last_name from employee;
+------------+-----------+
| first_name | last_name |
+------------+-----------+
| David      | Wallace   |
| Jan        | Levinson  |
| Michael    | Scott     |
| Angela     | Martin    |
| Kelly      | Kapoor    |
| Stanley    | Hudson    |
| Josh       | Porter    |
| Andy       | Bernard   |
| Jim        | Halpert   |
+------------+-----------+
9 rows in set (0.000 sec)

MariaDB [company]> select first_name AS forename, employee.last_name AS surname from employee;
+----------+----------+
| forename | surname  |
+----------+----------+
| David    | Wallace  |
| Jan      | Levinson |
| Michael  | Scott    |
| Angela   | Martin   |
| Kelly    | Kapoor   |
| Stanley  | Hudson   |
| Josh     | Porter   |
| Andy     | Bernard  |
| Jim      | Halpert  |
+----------+----------+
9 rows in set (0.001 sec)

MariaDB [company]> select DISTICt gender from employee;
ERROR 1054 (42S22): Unknown column 'DISTICt' in 'field list'
MariaDB [company]> select DISTICT gender from employee;
ERROR 1054 (42S22): Unknown column 'DISTICT' in 'field list'
MariaDB [company]> select DISCINCT gender from employee;
ERROR 1054 (42S22): Unknown column 'DISCINCT' in 'field list'
MariaDB [company]> select DISTINCT gender from employee;
+--------+
| gender |
+--------+
| M      |
| F      |
+--------+
2 rows in set (0.007 sec)

MariaDB [company]> select * from employee where gender = "M";
+--------+------------+-----------+------------+--------+--------+----------+-----------+
| emp_id | first_name | last_name | birth_day  | gender | salary | super_id | branch_id |
+--------+------------+-----------+------------+--------+--------+----------+-----------+
|    100 | David      | Wallace   | 1967-11-17 | M      | 250000 |     NULL |         1 |
|    102 | Michael    | Scott     | 1964-03-15 | M      |  75000 |      100 |         2 |
|    105 | Stanley    | Hudson    | 1958-02-19 | M      |  69000 |      102 |         2 |
|    106 | Josh       | Porter    | 1969-09-05 | M      |  78000 |      100 |         3 |
|    107 | Andy       | Bernard   | 1973-07-22 | M      |  65000 |      106 |         3 |
|    108 | Jim        | Halpert   | 1978-10-01 | M      |  71000 |      106 |         3 |
+--------+------------+-----------+------------+--------+--------+----------+-----------+
6 rows in set (0.002 sec)

MariaDB [company]> select * from employee where branch_id=2
    -> ;
+--------+------------+-----------+------------+--------+--------+----------+-----------+
| emp_id | first_name | last_name | birth_day  | gender | salary | super_id | branch_id |
+--------+------------+-----------+------------+--------+--------+----------+-----------+
|    102 | Michael    | Scott     | 1964-03-15 | M      |  75000 |      100 |         2 |
|    103 | Angela     | Martin    | 1971-06-25 | F      |  63000 |      102 |         2 |
|    104 | Kelly      | Kapoor    | 1980-02-05 | F      |  55000 |      102 |         2 |
|    105 | Stanley    | Hudson    | 1958-02-19 | M      |  69000 |      102 |         2 |
+--------+------------+-----------+------------+--------+--------+----------+-----------+
4 rows in set (0.004 sec)

MariaDB [company]>
